{
  "$schema": "https://json-schema.org/draft/2020-12/schema",
  "$id": "https://gua.dev/schema/ui-tree.schema.json",
  "title": "Gua UI Tree",
  "type": "object",
  "required": ["schemaVersion", "frameSequence", "revision", "screen", "nodes"],
  "additionalProperties": false,
  "properties": {
    "schemaVersion": { "const": 2 },
    "sessionEpoch": { "type": "integer", "minimum": 1 },
    "frameSequence": { "type": "integer", "minimum": 0 },
    "revision": { "type": "integer", "minimum": 0 },
    "screen": {
      "type": "string",
      "minLength": 1
    },
    "nodes": {
      "type": "array",
      "items": {
        "$ref": "#/$defs/node"
      }
    }
  },
  "$defs": {
    "bounds": {
      "type": "object",
      "required": [],
      "additionalProperties": false,
      "properties": {
        "x": { "type": "number" },
        "y": { "type": "number" },
        "w": { "type": "number", "minimum": 0 },
        "h": { "type": "number", "minimum": 0 }
      }
    },
    "node": {
      "type": "object",
      "required": ["id", "role", "visible", "enabled", "bounds", "actions"],
      "additionalProperties": false,
      "properties": {
        "id": { "type": "string", "minLength": 1 },
        "parentId": { "type": "string", "minLength": 1 },
        "role": {
          "type": "string",
          "enum": [
            "button",
            "text",
            "image",
            "checkbox",
            "radio",
            "slider",
            "textbox",
            "list",
            "listitem",
            "panel",
            "screen",
            "dialog",
            "menu",
            "menuitem",
            "combobox",
            "tablist",
            "tab",
            "scrollarea"
          ]
        },
        "label": { "type": "string" },
        "text": { "type": "string" },
        "value": { "type": ["number", "string", "boolean", "null"] },
        "visible": { "type": "boolean" },
        "enabled": { "type": "boolean" },
        "bounds": { "$ref": "#/$defs/bounds" },
        "state": {
          "type": "object",
          "additionalProperties": false,
          "properties": {
            "focused": { "type": "boolean" },
            "hovered": { "type": "boolean" },
            "pressed": { "type": "boolean" },
            "checked": { "type": "boolean" },
            "selected": { "type": "boolean" },
            "caretPosition": { "type": "integer", "minimum": 0 },
            "selectionStart": { "type": "integer", "minimum": 0 },
            "selectionEnd": { "type": "integer", "minimum": 0 },
            "scrollX": { "type": "number" },
            "scrollY": { "type": "number" },
            "scrollMaxX": { "type": "number", "minimum": 0 },
            "scrollMaxY": { "type": "number", "minimum": 0 },
            "rangeValue": { "type": "number" },
            "rangeMin": { "type": "number" },
            "rangeMax": { "type": "number" },
            "selectedIndex": { "type": "integer", "minimum": -1 },
            "value": {
              "type": ["number", "string", "boolean", "null"]
            }
          }
        },
        "actions": {
          "type": "array",
          "items": {
            "type": "string",
            "enum": ["click", "focus", "set_value", "set_checked", "select", "scroll", "press_key"]
          },
          "uniqueItems": true
        }
      }
    }
  }
}
