{
  "schemaVersion": 2,
  "sessionEpoch": 1,
  "frameSequence": 12,
  "revision": 4,
  "screen": "settings",
  "nodes": [
    {
      "id": "remember",
      "parentId": "form",
      "role": "checkbox",
      "label": "Remember me",
      "text": "Remember me",
      "visible": true,
      "enabled": true,
      "bounds": { "x": 10, "y": 20, "w": 100, "h": 24 },
      "state": { "focused": false, "checked": false, "caretPosition": 0, "selectionStart": 0, "selectionEnd": 0 },
      "actions": ["click", "focus"]
    },
    {
      "id": "difficulty",
      "parentId": "form",
      "role": "combobox",
      "label": "Difficulty",
      "value": "Hard",
      "visible": true,
      "enabled": true,
      "bounds": { "x": 10, "y": 50, "w": 100, "h": 24 },
      "state": { "selectedIndex": 2, "rangeValue": 2, "rangeMin": 0, "rangeMax": 3 },
      "actions": ["focus", "set_value"]
    }
  ]
}
